{
  "active_source": "openatv8",
  "authority": "Evolution-by-Warder/PiconHub-Warder-Evolution",
  "branch": "factory-warder-development",
  "last_checkpoint": {
    "master_commit": "f936138f49fd37c845939d1222d9589951bcae79",
    "note": "Git checkpoint metadata; not an approval.",
    "run": "20261014-openatv-owner-archive",
    "source_id": "openatv8",
    "source_manifest_sha256": "409809a233511794f1c064998bdd3a558d81dee36d274833f529b202bbdf09ee",
    "status": "AWAITING_APPROVAL"
  },
  "schema": 1,
  "source_order": [
    "openatv8",
    "vhannibal",
    "chocholousek"
  ],
  "sources": {
    "chocholousek": {
      "archive_sha256": null,
      "content_length": null,
      "content_manifest": [],
      "continuation_point": null,
      "etag": null,
      "last_checked_utc": null,
      "last_modified": null,
      "last_successful_download_utc": null,
      "last_successful_git_commit": null,
      "name": "Chocholousek",
      "official_identifier": "Chocholousek picon source",
      "open_decisions": 0,
      "qa_exceptions": 0,
      "release_id": null,
      "source_id": "chocholousek",
      "source_type": "satellite-picon-package",
      "status": "NOT_CHECKED"
    },
    "openatv8": {
      "archive_sha256": null,
      "batch_result": {
        "exact_master_byte_matches_same_reference": 673,
        "exact_master_references_with_candidate": 399,
        "existing_refs_different_only": 3336,
        "existing_refs_exact_and_different": 144,
        "existing_refs_exact_only": 255,
        "new_reference_observations": 40294,
        "output_bytes": 1295659578,
        "output_png_count": 48045,
        "qa_pass_triplets": 16015,
        "references_with_multiple_artworks": 9940,
        "render_failures": 1,
        "render_issue_counts": {
          "FULLY_TRANSPARENT": 1
        },
        "render_qa_seconds": 248.194,
        "rendered_triplets": 16015,
        "unique_artworks_not_exact_master": 16016,
        "unique_byte_artworks": 16173,
        "unique_new_references": 19526
      },
      "changed": 7121,
      "combined_input_archive_sha256": "b58689171780485889506ef6dbae5f68e70fe48ece3fc536926d4b89fec87dab",
      "content_length": 618394106,
      "content_manifest": [
        {
          "path": "factory/registry/source-manifests/openatv8/openatv8-09355350a12686c691d5d18dbb424ae53e8b50d4ad887db93ad34bdb70070373.jsonl.gz",
          "png_count": 30047,
          "sha256": "05a3de4dd89519786c6cc10632fc7c654f87ca73d67a507e9fba255070b11ba6"
        },
        {
          "path": "factory/registry/source-manifests/openatv8/openatv8-162117cf31343e0a153b4fd5297c6545b13a85833f1481d5d9e02fbcad9435de.jsonl.gz",
          "png_count": 30047,
          "sha256": "89b0b93309e05eef93914a00e4bf1b09d90f8698df7c79c67035fdd943cfb0ed"
        },
        {
          "path": "factory/registry/source-manifests/openatv8/openatv8-ebe435062e093607d8710950d009424fbcbadaccd726f42811fbd447bd6e14e8.jsonl.gz",
          "png_count": 44186,
          "sha256": "968c95dfb05eaec8a91794b49031a1ec24062fd9587d5cdf74d08560f9fb6b0a"
        },
        {
          "path": "factory/registry/source-manifests/openatv8/openatv8-f044684c32c051eb692305411225715b0c362f0bcae05c70eb3d155c1932022e.jsonl.gz",
          "png_count": 44186,
          "sha256": "72fd05b2da5629001a302a96031a4c6b53ed1beba34d284a2db00177a2b4293c"
        }
      ],
      "content_manifest_sha256": "409809a233511794f1c064998bdd3a558d81dee36d274833f529b202bbdf09ee",
      "continuation_point": {
        "required_next": "inspect service-reference identity conflicts; approve no artwork automatically",
        "run": "20261014-openatv-owner-archive",
        "stage": "awaiting_openatv_artwork_review"
      },
      "etag": null,
      "identical": 673,
      "invalid": 0,
      "last_checked_utc": "2026-10-14T10:03:18Z",
      "last_modified": null,
      "last_successful_download_utc": null,
      "last_successful_git_commit": null,
      "name": "OpenATV 8",
      "new": 19526,
      "official_identifier": "OpenATV 8 image/picon packages; vendor release ID unavailable in supplied snapshot",
      "open_decisions": null,
      "packages": {
        "09355350a12686c691d5d18dbb424ae53e8b50d4ad887db93ad34bdb70070373": {
          "metadata_manifest_path": "factory/registry/source-manifests/openatv8/openatv8-09355350a12686c691d5d18dbb424ae53e8b50d4ad887db93ad34bdb70070373.jsonl.gz",
          "metadata_manifest_sha256": "05a3de4dd89519786c6cc10632fc7c654f87ca73d67a507e9fba255070b11ba6",
          "png_count": 30047,
          "source_package_content_id": "09355350a12686c691d5d18dbb424ae53e8b50d4ad887db93ad34bdb70070373"
        },
        "162117cf31343e0a153b4fd5297c6545b13a85833f1481d5d9e02fbcad9435de": {
          "metadata_manifest_path": "factory/registry/source-manifests/openatv8/openatv8-162117cf31343e0a153b4fd5297c6545b13a85833f1481d5d9e02fbcad9435de.jsonl.gz",
          "metadata_manifest_sha256": "89b0b93309e05eef93914a00e4bf1b09d90f8698df7c79c67035fdd943cfb0ed",
          "png_count": 30047,
          "source_package_content_id": "162117cf31343e0a153b4fd5297c6545b13a85833f1481d5d9e02fbcad9435de"
        },
        "ebe435062e093607d8710950d009424fbcbadaccd726f42811fbd447bd6e14e8": {
          "metadata_manifest_path": "factory/registry/source-manifests/openatv8/openatv8-ebe435062e093607d8710950d009424fbcbadaccd726f42811fbd447bd6e14e8.jsonl.gz",
          "metadata_manifest_sha256": "968c95dfb05eaec8a91794b49031a1ec24062fd9587d5cdf74d08560f9fb6b0a",
          "png_count": 44186,
          "source_package_content_id": "ebe435062e093607d8710950d009424fbcbadaccd726f42811fbd447bd6e14e8"
        },
        "f044684c32c051eb692305411225715b0c362f0bcae05c70eb3d155c1932022e": {
          "metadata_manifest_path": "factory/registry/source-manifests/openatv8/openatv8-f044684c32c051eb692305411225715b0c362f0bcae05c70eb3d155c1932022e.jsonl.gz",
          "metadata_manifest_sha256": "72fd05b2da5629001a302a96031a4c6b53ed1beba34d284a2db00177a2b4293c",
          "png_count": 44186,
          "source_package_content_id": "f044684c32c051eb692305411225715b0c362f0bcae05c70eb3d155c1932022e"
        }
      },
      "png_observations": 148466,
      "qa_exceptions": 1,
      "release_id": "owner-provided-02-ORIGINALS / schema-3 content-addressed packages",
      "source_id": "openatv8",
      "source_type": "satellite-receiver-picon-package",
      "split_archive_parts": [
        {
          "bytes": 314572800,
          "name": "02-ORIGINALS.z01",
          "sha256": "987cccf43390153719a01ccf0cee6cb48bc2beb43b714afe6c182da9b1193163"
        },
        {
          "bytes": 314572800,
          "name": "02-ORIGINALS.z02",
          "sha256": "860ae54389dd53ab9acbe8e96544ff32351435db184a0873ff1fbb0971509b72"
        },
        {
          "bytes": 314572800,
          "name": "02-ORIGINALS.z03",
          "sha256": "b14bc318543fcd3f42ccc5bf21e13045ef7ccfd0855ffec8a53ca8066774aedc"
        },
        {
          "bytes": 314572800,
          "name": "02-ORIGINALS.z04",
          "sha256": "e7b0c831dcf1d04d8bb6ef7af18a5c03af9ee5198690b8f353a636ec69235792"
        },
        {
          "bytes": 165137117,
          "name": "02-ORIGINALS.zip",
          "sha256": "97e2b857a73cac6ded07972a99caed0cdcf3cd0495f298cc1e94d190b50118aa"
        }
      ],
      "status": "AWAITING_APPROVAL"
    },
    "vhannibal": {
      "archive_sha256": null,
      "content_length": null,
      "content_manifest": [],
      "continuation_point": null,
      "etag": null,
      "last_checked_utc": null,
      "last_modified": null,
      "last_successful_download_utc": null,
      "last_successful_git_commit": null,
      "name": "Vhannibal",
      "official_identifier": "Vhannibal source feed",
      "open_decisions": 0,
      "qa_exceptions": 0,
      "release_id": null,
      "source_id": "vhannibal",
      "source_type": "satellite-picon-package",
      "status": "NOT_CHECKED"
    }
  }
}
